{"capture":{"attested":true,"profile":"publication","publication_eligible":true,"redaction_policy":"publication-v1","scanner":{"ruleset":"secrets-v1","status":"passed"},"vault_present":false},"created_at":"2026-01-02T03:04:05.000Z","format":"nemoir.trace/0.1","integrity":{"algorithm":"sha256","entry":"integrity.json"},"provenance":{"compiler_version":"parity","complete":true,"frontend":"parity","runtime":{"name":"nemoir-runtime","version":"0.10.1"},"target":"manual"},"status":"complete","trace_id":"4f91f30cd030e4de15409e5b4d533a65","viewer":{"min_format":"nemoir.trace/0.1"},"workflow":{"entry":"A","exits":["C"],"id":"LoopTest","ir_sha256":"sha256:efefefefefefefefefefefefefefefefefefefefefefefefefefefefefefefef","ir_version":"0.1"}}